{
  "schema_version": "1.0",
  "cycle_intent": "Explain how Operation Selection fits into the Core architecture.",
  "scope": null,
  "execution_status": "active",
  "current_mode": "Explore",
  "movement_trigger": null,
  "relevant_workflow_phases": [],
  "applicable_rules": [],
  "required_artifacts": [
    "Understanding (.jes/artifacts/understanding.md)"
  ],
  "open_questions": [
    "scope not yet bounded"
  ],
  "active_operation": null,
  "authority_gates": [],
  "coherence_checklist": null,
  "updated_at": "2026-08-05T16:48:49Z"
}
